{
  "$schema": "../../specs/_schemas/component-governance-evidence.schema.json",
  "schemaVersion": 1,
  "componentMetadataGlob": "specs/components/**/*.json",
  "defaults": {
    "reviews": {
      "design": "pending",
      "api": "pending",
      "accessibility": "pending",
      "content": "pending"
    },
    "keyboardTest": "automated",
    "screenReaderTest": "manual-pending",
    "responsiveReview": "automated",
    "themeReview": "automated",
    "reducedMotionReview": "automated",
    "localizationReview": "partial",
    "visualRegression": "automated",
    "figmaCodeParity": "automated-snapshot",
    "productionUsage": {
      "status": "not-established",
      "evidence": []
    },
    "issueSeverity": {
      "p0": 0,
      "p1": 0,
      "evidence": []
    },
    "adoption": {
      "status": "not-established",
      "consumers": [],
      "evidence": []
    },
    "a11yAudit": {
      "status": "automated-only",
      "evidence": ["testing/accessibility/coverage-map.json"]
    },
    "stableEligible": false
  },
  "overrides": {}
}
